{
  "schema_version": "0.1.0-draft",
  "job_id": "JOB-MOCK-001",
  "scenario_id": "SCN-MOCK-001",
  "snapshot_id": "SNAP-MOCK-001",
  "reserved_plan_id": "PLAN-RESERVED-001",
  "job_state": "canceled",
  "solver_status": null,
  "plan_id": null,
  "has_validated_plan": false,
  "runtime_s": 0,
  "stop_reason": "canceled",
  "created_at": "2026-10-17T09:00:00+08:00",
  "started_at": "2026-10-17T09:00:00+08:00",
  "finished_at": "2026-10-17T09:00:00+08:00",
  "error": null
}
